movie_name,ost_name,artist,year,mvdir,mvact,gerne,valence,acousticness,danceability,energy,loudness,tempo
Black Widow,Yelena Belova,Lorne Balfe,2021,케이트 쇼트랜드,"스칼릿 조핸슨, 데이빗 하버, 플로렌스 퓨, 레이첼 와이즈","액션, 모험, SF",0.0392,0.669,0.38,0.302,-14.186,100.007
Black Widow,The First Bite Is the Deepest,Lorne Balfe,2021,케이트 쇼트랜드,"스칼릿 조핸슨, 데이빗 하버, 플로렌스 퓨, 레이첼 와이즈","액션, 모험, SF",0.108,0.00368,0.569,0.858,-9.129,110.003
Black Widow,Red Rising,Lorne Balfe,2021,케이트 쇼트랜드,"스칼릿 조핸슨, 데이빗 하버, 플로렌스 퓨, 레이첼 와이즈","액션, 모험, SF",0.138,0.006,0.329,0.716,-10.42,92.327
Clifford the Big Red Dog,Room For You,Clifford The Big Red Dog,2021,월트 베커,"다비 캠프, 잭 화이트홀, 존 클리즈, 시에나 길로리","모험, 드라마, 가족",0.548,0.3,0.634,0.709,-6.478,103.959
Cruella,Call me Cruella,Florence + The Machine,2021,크레이그 질레스피,엠마 스톤,"드라마, 범죄, 코미디",0.246,0.0836,0.581,0.567,-9.645,100.994
Cruella,The Baroque Ball,Nicholas Britell,2021,크레이그 질레스피,엠마 스톤,"드라마, 범죄, 코미디",0.466,0.412,0.451,0.437,-7.904,82.544
Cruella,"Goodbye, Estella",Nicholas Britell,2021,크레이그 질레스피,엠마 스톤,"드라마, 범죄, 코미디",0.166,0.114,0.634,0.494,-10.157,99.042
Don't Look Up,Just Look Up (From Don’t Look Up),Ariana Grande,2021,아담 맥케이,"레오나르도 디카프리오, 제니퍼 로렌스, 롭 모건",코미디,0.152,0.216,0.566,0.581,-5.181,130.043
Don't Look Up,Don't Look Up,Nicholas Britell,2021,아담 맥케이,"레오나르도 디카프리오, 제니퍼 로렌스, 롭 모건",코미디,0.367,0.00713,0.587,0.559,-6.307,117.946
Don’t Breathe 2,Main On Ends,Roque Banos,2021,로도 사야구에즈,"스티븐 랭, 브렌단 섹스톤, 매들린 그레이스","범죄, 공포, 스릴러",0.41,0.000009,0.429,0.941,-7.106,162.618
Dune,Leaving Caladan,Hans Zimmer,2021,드니 빌뇌브,"티모시 샬라메, 레베카 퍼거슨, 오스카 아이삭","모험, 드라마, SF",0.036,0.00126,0.33,0.481,-11.645,120.456
Dune,Dream of Arrakis,Hans Zimmer,2021,드니 빌뇌브,"티모시 샬라메, 레베카 퍼거슨, 오스카 아이삭","모험, 드라마, SF",0.0384,0.28,0.289,0.206,-21.706,159.959
Dune,Eclipse (From Dune: Original Motion Picture Soundtrack) [Trailer Version],Hans Zimmer,2021,드니 빌뇌브,"티모시 샬라메, 레베카 퍼거슨, 오스카 아이삭","모험, 드라마, SF",0.222,0.00597,0.232,0.868,-6.4,136.136
Encanto,Surface Pressure,Jessica Darrow,2021,"자레드 부시, 바이론 하워드, 채리스 카스트로 스미스","다이앤 게레로, 스테파니 비트리즈, 윌머 발더라마, 렌지 펠리즈, 앤지 세페다",애니메이션,0.37,0.0174,0.65,0.584,-8.286,180.088
Encanto,We Don't Talk About Bruno,Carolina Gaitán - La Gaita,2021,"자레드 부시, 바이론 하워드, 채리스 카스트로 스미스","다이앤 게레로, 스테파니 비트리즈, 윌머 발더라마, 렌지 펠리즈, 앤지 세페다",애니메이션,0.83,0.357,0.577,0.45,-8.516,205.863
Encanto,The Family Madrigal,Stephanie Beatriz,2021,"자레드 부시, 바이론 하워드, 채리스 카스트로 스미스","다이앤 게레로, 스테파니 비트리즈, 윌머 발더라마, 렌지 펠리즈, 앤지 세페다",애니메이션,0.556,0.12,0.594,0.628,-6.345,141.391
Escape Room: Tournament of Champions,Escape Room: Tournament of Champions (Brian Tyler and Kill The Noise Remix) (feat. Kill The Noise),Brian Tyler,2021,애덤 로비텔,"테일러 러셀, 로건 밀러","액션, 공포, 스릴러",0.308,0.00223,0.506,0.864,-7.225,171.905
Escape Room: Tournament of Champions,Blood Money,Brian Tyler,2021,애덤 로비텔,"테일러 러셀, 로건 밀러","액션, 공포, 스릴러",0.114,0.00718,0.336,0.634,-11.691,139.943
Eternals,Eternals Theme,Ramin Djawadi,2021,클로이 자오,"안젤리나 졸리, 마동석, 리차드 매든, 쿠마일 난지아니, 셀마 헤이엑, 젬마 찬, 로런 리들로프, 브라이언 타이리 헨리, 배리 케오간, 리아 맥휴","액션, 드라마, 판타지",0.234,0.0937,0.434,0.413,-13.917,90.018
Eternals,Across the Oceans of Time,Ramin Djawadi,2021,클로이 자오,"안젤리나 졸리, 마동석, 리차드 매든, 쿠마일 난지아니, 셀마 헤이엑, 젬마 찬, 로런 리들로프, 브라이언 타이리 헨리, 배리 케오간, 리아 맥휴","액션, 드라마, 판타지",0.0347,0.891,0.138,0.136,-17.257,142.22
Eternals,Nach Mera Hero,Celina Sharma,2021,클로이 자오,"안젤리나 졸리, 마동석, 리차드 매든, 쿠마일 난지아니, 셀마 헤이엑, 젬마 찬, 로런 리들로프, 브라이언 타이리 헨리, 배리 케오간, 리아 맥휴","액션, 드라마, 판타지",0.0686,0.216,0.615,0.421,-11.317,132.149
F9: The Fast Saga,I Won,Ty Dolla $ign,2021,저스틴 린,"빈 디젤, 샤를리즈 테론, 미셸 로드리게즈",액션,0.672,0.272,0.762,0.788,-4.087,140.993
F9: The Fast Saga,Fast Lane,Don Toliver,2021,저스틴 린,"빈 디젤, 샤를리즈 테론, 미셸 로드리게즈",액션,0.527,0.346,0.594,0.722,-4.571,177.956
F9: The Fast Saga,"Lane Switcha (feat. A$AP Rocky, Juicy J & Project Pat)",Skepta,2021,저스틴 린,"빈 디젤, 샤를리즈 테론, 미셸 로드리게즈",액션,0.559,0.493,0.652,0.842,-3.181,165.063
Fear Street Part Two: 1978,Cindy and Ziggy,Marco Beltrami,2021,리 자니악,"세이디 싱크, 에밀리 러드, 마이클 프로",공포,0.0326,0.986,0.26,0.0203,-25.927,130.072
Fear Street Part Two: 1978,Chased Through the Woods,Marco Beltrami and Buck Sanders,2021,리 자니악,"세이디 싱크, 에밀리 러드, 마이클 프로",공포,0.0393,0.895,0.448,0.3,-13.884,139.488
Fear Street Part Two: 1978,Heart of Darkness,Marco Beltrami,2021,리 자니악,"세이디 싱크, 에밀리 러드, 마이클 프로",공포,0.0684,0.882,0.504,0.454,-11.933,79.973
Free Guy,Have a Great Day,Christophe Beck,2021,숀 레비,라이언 레이놀즈,"액션, 모험",0.141,0.976,0.418,0.199,-16.161,141.929
Free Guy,I Remember Everything,Christophe Beck,2021,숀 레비,라이언 레이놀즈,"액션, 모험",0.0394,0.896,0.315,0.251,-16.722,121.918
Free Guy,Reunited,Christophe Beck,2021,숀 레비,라이언 레이놀즈,"액션, 모험",0.0392,0.985,0.219,0.0448,-27.407,114.581
Ghostbusters: Afterlife,Trapped,Rob Simonsen,2021,제이슨 라이트맨,"캐리 쿤, 핀 울프하드, 맥케나 그레이스, 폴 러드","서스펜스, 모험, 액션",0.0324,0.745,0.219,0.181,-16.347,81.51
Ghostbusters: Afterlife,Under the Floor,Rob Simonsen,2021,제이슨 라이트맨,"캐리 쿤, 핀 울프하드, 맥케나 그레이스, 폴 러드","서스펜스, 모험, 액션",0.0325,0.911,0.0726,0.0378,-29.651,74.181
Ghostbusters: Afterlife,Lab Partners,Rob Simonsen,2021,제이슨 라이트맨,"캐리 쿤, 핀 울프하드, 맥케나 그레이스, 폴 러드","서스펜스, 모험, 액션",0.232,0.937,0.558,0.116,-17.996,137.459
Godzilla vs. Kong,"Pensacola, Florida (Godzilla Theme)",Tom Holkenborg,2021,애덤 윈가드,"알렉산더 스카스가드, 밀리 바비 브라운",액션,0.0609,0.773,0.142,0.161,-15.399,159.885
Godzilla vs. Kong,Skull Island (Kong Theme),Tom Holkenborg,2021,애덤 윈가드,"알렉산더 스카스가드, 밀리 바비 브라운",액션,0.0397,0.851,0.257,0.176,-14.633,120.01
Godzilla vs. Kong,Mega,Tom Holkenborg,2021,애덤 윈가드,"알렉산더 스카스가드, 밀리 바비 브라운",액션,0.0383,0.237,0.0807,0.44,-13.925,80.978
Halloween Kills,The Myer's House,John Carpenter,2021,데이빗 고든 그린,"제이미 리 커티스, 주디 그리어, 앤디 마티첵",공포,0,0.966,0.757,0.016,-17.567,59.934
Halloween Kills,Halloween Kills (Main Title),John Carpenter,2021,데이빗 고든 그린,"제이미 리 커티스, 주디 그리어, 앤디 마티첵",공포,0.0394,0.964,0.468,0.227,-14.155,135.969
House of Gucci,Faith,George Michael,2021,리들리 스콧,"레이디 가가, 아담 드라이버, 자레드 레토, 알 파치노, 제레미 아이언스, 셀마 헤이엑","스릴러, 드라마, 범죄",0.607,0.0094,0.887,0.48,-11.994,95.846
House of Gucci,House of Gucci Score Suite,Harry Gregson,2021,리들리 스콧,"레이디 가가, 아담 드라이버, 자레드 레토, 알 파치노, 제레미 아이언스, 셀마 헤이엑","스릴러, 드라마, 범죄",0.0655,0.809,0.357,0.403,-14.739,174.023
In the Heights,In The Heights,Anthony RamosAnthony Ramos,2021,존 추,"안소니 라모스, 멜리사 바레사, 코리 호킨스, 레슬리 그레이스, 스테파니 비트리즈, 린-마누엘 미란다",뮤지컬,0.713,0.121,0.575,0.535,-7.452,167.834
In the Heights,When You're Home,Leslie GraceLeslie Grace,2021,존 추,"안소니 라모스, 멜리사 바레사, 코리 호킨스, 레슬리 그레이스, 스테파니 비트리즈, 린-마누엘 미란다",뮤지컬,0.314,0.0344,0.602,0.616,-8.109,102.06
Jungle Cruise,Jungle Cruise Suite,James Newton Howard,2021,자움 콜렛 세라,"드웨인 존슨, 에밀리 블런트","액션, 모험",0.0389,0.655,0.167,0.248,-14.847,91.79
Jungle Cruise,Nothing Else Matters (feat. Metallica) (Jungle Cruise Version Part 2),James Newton Howard,2021,자움 콜렛 세라,"드웨인 존슨, 에밀리 블런트","액션, 모험",0.191,0.873,0.439,0.278,-20.265,150.176
Jungle Cruise,I Built a Boat,James Newton Howard,2021,자움 콜렛 세라,"드웨인 존슨, 에밀리 블런트","액션, 모험",0.0524,0.972,0.13,0.112,-24.984,90.158
Mortal Kombat,Techno Syndrome 2021 (Mortal Kombat),Benjamin？Wallfisch,2021,사이먼 맥쿼이드,"루이스 탄, 조 타슬림, 루디 린, 제시카 맥나미, 사나다 히로유키, 아사노 타다노부, 메카드 브룩스, 조쉬 로슨, 친 한","액션, 모험, 판타지",0.273,0.00016,0.534,0.968,-5.346,141.974
Mortal Kombat,I Am Scorpion,Benjamin Wallfisch,2021,사이먼 맥쿼이드,"루이스 탄, 조 타슬림, 루디 린, 제시카 맥나미, 사나다 히로유키, 아사노 타다노부, 메카드 브룩스, 조쉬 로슨, 친 한","액션, 모험, 판타지",0.0723,0.000136,0.263,0.661,-11.627,155.318
No Time to Die,No Time To Die,Billie Eilish,2021,캐리 후쿠나가,"다니엘 크레이그, 라미 말렉, 레아 세이두, 라샤나 린치",액션,0.0517,0.917,0.38,0.219,-13.273,73.537
No Time to Die,Final Ascent,Hans Zimmer,2021,캐리 후쿠나가,"다니엘 크레이그, 라미 말렉, 레아 세이두, 라샤나 린치",액션,0.0346,0.159,0.203,0.0935,-15.575,41.858
No Time to Die,Home,Hans Zimmer,2021,캐리 후쿠나가,"다니엘 크레이그, 라미 말렉, 레아 세이두, 라샤나 린치",액션,0.0324,0.467,0.109,0.0696,-20.689,93.07
PAW Patrol: The Movie,Good Mood,Adam Levine(Maroon 5),2021,캘런 브런커,"정선혜, 신용우, 김새해, 엄상현, 박지윤, 문남숙, 전숙경, 은영선, 사성웅",애니메이션,0.777,0.00088,0.735,0.694,-5.258,121.46
Peter Rabbit 2: The Runaway,The Best of Times,Dominic Lewis,2021,윌 글럭,"제임스 코든, 도널 글리슨, 로즈 번","애니메이션, 모험, 코미디",0.416,0.866,0.396,0.285,-15.251,107.739
Peter Rabbit 2: The Runaway,Cheese Escape,Dominic Lewis,2021,윌 글럭,"제임스 코든, 도널 글리슨, 로즈 번","애니메이션, 모험, 코미디",0.126,0.369,0.384,0.575,-13.243,143.504
Ron’s Gone Wrong,Sunshine (From the Motion Picture “Ron’s Gone Wrong”),Liam Payne,2021,"사라 스미스, 진-필리프 바인, 옥타비오 E. 로드리게즈","자흐 갈리피아나키스, 잭 딜런 그레이저, 올리비아 콜맨, 에드 헬름스, 저스티스 스미스, 롭 딜레이니",애니메이션,0.787,0.0504,0.717,0.735,-5.764,107
Ron’s Gone Wrong,New Friends,Dave Bayley,2021,"사라 스미스, 진-필리프 바인, 옥타비오 E. 로드리게즈","자흐 갈리피아나키스, 잭 딜런 그레이저, 올리비아 콜맨, 에드 헬름스, 저스티스 스미스, 롭 딜레이니",애니메이션,0.753,0.107,0.75,0.518,-8.754,86.596
Ron’s Gone Wrong,Happy Late Birthday,Henry Jackman,2021,"사라 스미스, 진-필리프 바인, 옥타비오 E. 로드리게즈","자흐 갈리피아나키스, 잭 딜런 그레이저, 올리비아 콜맨, 에드 헬름스, 저스티스 스미스, 롭 딜레이니",애니메이션,0.118,0.693,0.271,0.177,-17.675,69.135
Shang-Chi and the Legend of the Ten Rings,Fire In The Sky,Anderson.Paak,2021,데스틴 크리튼,"시무 리우, 양조위, 아콰피나","액션, 모험, 판타지",0.737,0.0837,0.668,0.856,-6.386,79.008
Shang-Chi and the Legend of the Ten Rings,Xu Shang,Joel P West,2021,데스틴 크리튼,"시무 리우, 양조위, 아콰피나","액션, 모험, 판타지",0.568,0.24,0.373,0.748,-8.472,86.954
Shang-Chi and the Legend of the Ten Rings,Diamonds + And Pearls,DPR LIVEDPR LIVE,2021,데스틴 크리튼,"시무 리우, 양조위, 아콰피나","액션, 모험, 판타지",0.366,0.46,0.531,0.902,-2.886,94.009
Sing 2,A Sky Full of Stars,Taron Egerton,2021,가스 제닝스,"스칼릿 조핸슨, 태런 에저튼, 리즈 위더스푼, 매튜 맥커너히, 토리 켈리, 보노, 퍼렐 윌리엄스",애니메이션,0.429,0.152,0.44,0.676,-7.57,125.013
Sing 2,I Still Haven’t Found What I’m Looking For,Scarlett Johansson,2021,가스 제닝스,"스칼릿 조핸슨, 태런 에저튼, 리즈 위더스푼, 매튜 맥커너히, 토리 켈리, 보노, 퍼렐 윌리엄스",애니메이션,0.0632,0.0969,0.551,0.553,-8.226,101.042
Sing 2,Could Have Been Me,Halsey,2021,가스 제닝스,"스칼릿 조핸슨, 태런 에저튼, 리즈 위더스푼, 매튜 맥커너히, 토리 켈리, 보노, 퍼렐 윌리엄스",애니메이션,0.572,9.18E-05,0.552,0.662,-6.225,79.973
Space Jam: A New Legacy,Just For Me (feat. SZA) (Space Jam: A New Legacy),SAINt JHN,2021,말콤 D. 리,"르브론 제임스, 돈 치들, 젠데이아 콜먼, 소네쿠아 마틴 그린, 제프 버그먼, 에릭 바우사","애니메이션, 모험, 코미디",0.604,0.286,0.711,0.692,-4.34,98.929
Space Jam: A New Legacy,We Win (Space Jam: A New Legacy),Lil Baby,2021,말콤 D. 리,"르브론 제임스, 돈 치들, 젠데이아 콜먼, 소네쿠아 마틴 그린, 제프 버그먼, 에릭 바우사","애니메이션, 모험, 코미디",0.42,0.0184,0.448,0.921,-3.609,83.762
Space Jam: A New Legacy,A New Legacy,Kris Bowers,2021,말콤 D. 리,"르브론 제임스, 돈 치들, 젠데이아 콜먼, 소네쿠아 마틴 그린, 제프 버그먼, 에릭 바우사","애니메이션, 모험, 코미디",0.0379,0.000358,0.411,0.866,-8.96,169.101
Spider-Man: No Way Home,Arachnoverture,Michael Giacchino,2021,존 왓츠,"톰 홀랜드, 젠데이아 콜먼, 베네딕트 컴버배치, 존 파브로, 제이콥 배덜런, 마리사 토메이, 알프리드 몰리나","액션, 모험, SF",0.0537,0.453,0.176,0.201,-15.155,136.426
Spider-Man: No Way Home,Forget Me Knots,Michael Giacchino,2021,존 왓츠,"톰 홀랜드, 젠데이아 콜먼, 베네딕트 컴버배치, 존 파브로, 제이콥 배덜런, 마리사 토메이, 알프리드 몰리나","액션, 모험, SF",0.03,0.85,0.0691,0.0614,-19.004,73.215
Spider-Man: No Way Home,Peter Parker Picked a Perilously Precarious Profession,Michael Giacchino,2021,존 왓츠,"톰 홀랜드, 젠데이아 콜먼, 베네딕트 컴버배치, 존 파브로, 제이콥 배덜런, 마리사 토메이, 알프리드 몰리나","액션, 모험, SF",0.0672,0.729,0.291,0.0304,-16.878,60.185
Spiral,You Ain't Hard,Young Nudy,2021,세실리아 펠메리,세실리아 펠메리,드라마,0.772,0.0688,0.724,0.661,-4.563,171.969
Spiral,Spiral,21 Savage,2021,세실리아 펠메리,세실리아 펠메리,드라마,0.13,0.00161,0.814,0.659,-4.475,88.521
The Addams Family 2,The Addams Family (Theme),Christina Aguilera,2021,"그렉 티어난, 콘래드 버논","오스카 아이삭, 샤를리즈 테론, 클로이 모레츠, 닉 크롤, 스눕 독, 빌 헤이더, 제이본 워너 월튼","애니메이션, 코미디, 가족",0.922,0.0812,0.831,0.446,-8.845,121.002
The Conjuring: The Devil Made Me Do It,Devil Opening,Joseph Bishara,2021,마이클 차베즈,"베라 파미가, 패트릭 윌슨, 줄리안 힐리아드","공포, 미스터리, 스릴러",0.0727,0.889,0.199,0.292,-25.334,79.453
The Conjuring: The Devil Made Me Do It,wilds of the Devil,Joseph Bishara,2021,마이클 차베즈,"베라 파미가, 패트릭 윌슨, 줄리안 힐리아드","공포, 미스터리, 스릴러",0.035,0.845,0.101,0.35,-18.547,83.886
The Conjuring: The Devil Made Me Do It,Soaring curses,Joseph Bishara,2021,마이클 차베즈,"베라 파미가, 패트릭 윌슨, 줄리안 힐리아드","공포, 미스터리, 스릴러",0.0366,0.946,0.0994,0.22,-15.944,80.044
The French Dispatch,Aline,Jarvis Cocker,2021,웨스 앤더슨,"티모시 샬라메, 빌 머레이, 틸다 스윈튼, 제프리 라이트, 베니시오 델 토로, 레아 세이두, 프란시스 맥도맨드, 애드리언 브로디, 오웬 윌슨, 리나 쿠드리, 스티브 박, 마티유 아말릭","코미디, 드라마, 멜로/로맨스",0.423,0.12,0.239,0.59,-8.319,178.701
The French Dispatch,Obituary,Alexandre Desplat,2021,웨스 앤더슨,"티모시 샬라메, 빌 머레이, 틸다 스윈튼, 제프리 라이트, 베니시오 델 토로, 레아 세이두, 프란시스 맥도맨드, 애드리언 브로디, 오웬 윌슨, 리나 쿠드리, 스티브 박, 마티유 아말릭","코미디, 드라마, 멜로/로맨스",0.72,0.949,0.766,0.186,-15.365,158.922
The Hitman’s Wife’s Bodyguard,The Hitman's Wife's Bodyguard,Atli Orvarsson,2021,패트릭 휴스,"라이언 레이놀즈, 사무엘 L. 잭슨, 셀마 헤이엑","액션, 코미디",0.0365,0.149,0.225,0.548,-9.34,121.062
The King’s Man,The King's Man,Matthew Margeson,2021,매튜 본,"랄프 파인즈, 해리스 딕킨슨",액션,0.106,0.728,0.0915,0.332,-12.729,79.255
The King’s Man,Dance on Your Graves,Matthew Margeson,2021,매튜 본,"랄프 파인즈, 해리스 딕킨슨",액션,0.175,0.28,0.189,0.536,-7.787,84.315
The Matrix Resurrections,Opening,Johnny Klimek,2021,라나 워쇼스키,"키아누 리브스, 캐리 앤 모스","액션, SF",0.0373,0.128,0.219,0.363,-17.935,150.031
The Power Of The Dog,25 Years,Jonny Greenwood,2021,제인 캠피온,"커스틴 던스트, 짐 개피건, 제시 플레먼스, 키스 캐러딘, 토마신 맥켄지, 베네딕트 컴버배치, 코디 스밋 맥피","드라마, 멜로/로맨스, 서스펜스, 미스터리",0.32,0.894,0.407,0.12,-16.509,100.096
The Power Of The Dog,The Ravine,Jonny Greenwood,2021,제인 캠피온,"커스틴 던스트, 짐 개피건, 제시 플레먼스, 키스 캐러딘, 토마신 맥켄지, 베네딕트 컴버배치, 코디 스밋 맥피","드라마, 멜로/로맨스, 서스펜스, 미스터리",0.03,0.995,0.155,0.0654,-18.337,69.757
The Power Of The Dog,West,Jonny Greenwood,2021,제인 캠피온,"커스틴 던스트, 짐 개피건, 제시 플레먼스, 키스 캐러딘, 토마신 맥켄지, 베네딕트 컴버배치, 코디 스밋 맥피","드라마, 멜로/로맨스, 서스펜스, 미스터리",0.0303,0.979,0.15,0.231,-13.038,161.085
The Suicide Squad,Folsom Prison Blues (Live),Johnny Cash,2021,제임스 건,"마고 로비, 이드리스 엘바, 존 시나, 조엘 킨나만, 실베스터 스탤론, 비올라 데이비스","액션, 모험, 판타지, 미스터리, SF",0.889,0.0652,0.621,0.524,-15.269,110.586
The Suicide Squad,Sucker's Prayer,Decemberists,2021,제임스 건,"마고 로비, 이드리스 엘바, 존 시나, 조엘 킨나만, 실베스터 스탤론, 비올라 데이비스","액션, 모험, 판타지, 미스터리, SF",0.551,0.00831,0.384,0.697,-6.196,149.007
The Suicide Squad,Samba Na Sola,Ceu,2021,제임스 건,"마고 로비, 이드리스 엘바, 존 시나, 조엘 킨나만, 실베스터 스탤론, 비올라 데이비스","액션, 모험, 판타지, 미스터리, SF",0.893,0.715,0.748,0.459,-12.768,102.146
"tick, tick... BOOM!",30/90,Andrew GarfieldAndrew Garfield,2021,린-마누엘 미란다,"앤드류 가필드, 알렉산드라 쉽, 로빈 드 지저스, 바네사 허진스, 브래드리 휘트포드, 주디스 라이트","드라마, 뮤지컬",0.36,0.0146,0.466,0.789,-5.956,175.772
"tick, tick... BOOM!",Louder Than Words,Andrew GarfieldAndrew Garfield,2021,린-마누엘 미란다,"앤드류 가필드, 알렉산드라 쉽, 로빈 드 지저스, 바네사 허진스, 브래드리 휘트포드, 주디스 라이트","드라마, 뮤지컬",0.42,0.0994,0.333,0.581,-5.497,95.202
"tick, tick... BOOM!",Come to Your Senses,Alexandra ShippAlexandra Shipp,2021,린-마누엘 미란다,"앤드류 가필드, 알렉산드라 쉽, 로빈 드 지저스, 바네사 허진스, 브래드리 휘트포드, 주디스 라이트","드라마, 뮤지컬",0.225,0.431,0.393,0.444,-5.745,98.523
Tom and Jerry,Tom and Jerry,Christopher Lennertz,2021,팀 스토리,"클로이 모레츠, 켄 정, 마이클 페나",애니메이션,0.181,0.00323,0.695,0.626,-9.676,100.99
Tom and Jerry,Tom in Disguise,Christopher Lennertz,2021,팀 스토리,"클로이 모레츠, 켄 정, 마이클 페나",애니메이션,0.0463,0.0264,0.422,0.336,-15.248,138.571
Venom: Let There be Carnage,Last One Standing (From Venom: Let There Be Carnage),Skylar Grey,2021,앤디 서키스,"톰 하디, 미셸 윌리엄스","액션, SF, 스릴러",0.233,0.237,0.664,0.692,-4.128,154.924
Venom: Let There be Carnage,St. Estes Reform School (Extended),Marco Beltrami,2021,앤디 서키스,"톰 하디, 미셸 윌리엄스","액션, SF, 스릴러",0.0391,0.118,0.185,0.234,-15.574,113.13
Venom: Let There be Carnage,Carnage Unleashed,Marco Beltrami,2021,앤디 서키스,"톰 하디, 미셸 윌리엄스","액션, SF, 스릴러",0.0385,0.00383,0.22,0.788,-10.043,111.84
West Side Story,Something's Coming,Ansel Elgort,2021,스티븐 스필버그,"안셀 엘고트, 마이크 파이스트, 레이첼 지글러, 데이비드 알바즈, 아리아나 데보스","드라마, 뮤지컬",0.316,0.445,0.423,0.208,-16.142,96.321
West Side Story,Balcony Scene (Tonight),Rachel Zegler,2021,스티븐 스필버그,"안셀 엘고트, 마이크 파이스트, 레이첼 지글러, 데이비드 알바즈, 아리아나 데보스","드라마, 뮤지컬",0.113,0.795,0.165,0.0738,-17.947,64.063
West Side Story,Maria,Ansel Elgort,2021,스티븐 스필버그,"안셀 엘고트, 마이크 파이스트, 레이첼 지글러, 데이비드 알바즈, 아리아나 데보스","드라마, 뮤지컬",0.126,0.684,0.277,0.0925,-17.915,115.163
Wrath of Man,Wrath of Man,Chris Benstead,2021,가이 리치,"제이슨 스타뎀, 스콧 이스트우드, 조쉬 하트넷, 포스트 말론, 홀트 맥칼라니, 제프리 도노반",액션,0.155,0.0791,0.449,0.321,-12.95,137.002
Wrath of Man,F**king Lunatic,Chris Benstead,2021,가이 리치,"제이슨 스타뎀, 스콧 이스트우드, 조쉬 하트넷, 포스트 말론, 홀트 맥칼라니, 제프리 도노반",액션,0.0402,0.21,0.825,0.181,-11.8,120.855
Antebellum,Opening,"Nate Wonder, Roman Gianarthur",2020,"제라드 부시, 크리스토퍼 렌즈","자넬 모네, 지나 말론, 잭 휴스턴","미스터리, 스릴러",0.0302,0.306,0.29,0.0171,-19.87,167.904
Bad Boys For Life,RITMO (Bad Boys For Life),"Black Eyed Peas, J Balvin",2020,"아딜 엘 아르비, 빌랄 팔라","마틴 로렌스, 윌 스미스",액션,0.666,0.0295,0.732,0.716,-6.968,105.093
Bad Boys For Life,Muevelo,"Nicky Jam, Daddy Yankee",2020,"아딜 엘 아르비, 빌랄 팔라","마틴 로렌스, 윌 스미스",액션,0.919,0.415,0.594,0.808,-2.409,188.09
Bad Boys For Life,Damn I Love Miami,"Pitbull, Lil Jon",2020,"아딜 엘 아르비, 빌랄 팔라","마틴 로렌스, 윌 스미스",액션,0.673,0.0584,0.796,0.942,-4.952,124.008
Bad Boys For Life,Uptown II (feat. Farruko),Meek Mill,2020,"아딜 엘 아르비, 빌랄 팔라","마틴 로렌스, 윌 스미스",액션,0.25,0.00621,0.775,0.794,-3.875,99.04
Bill & Ted Face the Music,Beginning Of The End (Wyld Stallyns Edit),Weezer,2020,딘 패리소트,"키아누 리브스, 알렉스 윈터, 사마라 위빙, 브리젯 런디-페인",코미디 모험,0.391,0.000308,0.499,0.817,-4.838,137.88
Bill & Ted Face the Music,Lost In Time,Big Black Delta,2020,딘 패리소트,"키아누 리브스, 알렉스 윈터, 사마라 위빙, 브리젯 런디-페인",코미디 모험,0.384,0.00317,0.632,0.948,-6.02,110.003
Birds of Prey: And the Fantabulous Emancipation of One Harley Quinn,Boss Bitch,Doja Cat,2020,캐시 얀,마고 로비,"액션, 모험, 범죄",0.575,0.127,0.707,0.955,-4.593,125.993
Birds of Prey: And the Fantabulous Emancipation of One Harley Quinn,Sway With Me,"Saweetie, GALXARA",2020,캐시 얀,마고 로비,"액션, 모험, 범죄",0.875,0.00468,0.621,0.849,-4.243,130.979
Birds of Prey: And the Fantabulous Emancipation of One Harley Quinn,Joke's On You,Charlotte Lawren,2020,캐시 얀,마고 로비,"액션, 모험, 범죄",0.47,0.23,0.476,0.652,-4.546,190.118
Birds of Prey: And the Fantabulous Emancipation of One Harley Quinn,The Fantabulous Emancipation Explosion,Daniel Pemberton,2020,캐시 얀,마고 로비,"액션, 모험, 범죄",0.0795,0.307,0.408,0.452,-6.442,189.867
Bloodshot,Wake Up,Steve Jablonsky,2020,데이브 윌슨,"빈 디젤, 에이사 곤잘레스, 샘 휴건, 가이 피어스, 토비 켑벨","액션, 드라마, 판타지, SF",0.0373,0.79,0.186,0.157,-22.154,119.818
Bloodshot,Training Montage,Steve Jablonsky,2020,데이브 윌슨,"빈 디젤, 에이사 곤잘레스, 샘 휴건, 가이 피어스, 토비 켑벨","액션, 드라마, 판타지, SF",0.0388,0.0298,0.504,0.474,-14.423,117.9
Bloodshot,Die Already,Steve Jablonsky,2020,데이브 윌슨,"빈 디젤, 에이사 곤잘레스, 샘 휴건, 가이 피어스, 토비 켑벨","액션, 드라마, 판타지, SF",0.051,0.308,0.171,0.834,-10.499,116.062
