movie_name,ost_name,artist,year,mvdir,mvact,gerne,valence,acousticness,danceability,energy,loudness,tempo
Deliver Us From Eva,Paradise,LL Cool J,2003,게리 하드윅,"LL 쿨 J, 가브리엘 유니온",미국,0.856,0.0165,0.778,0.823,-2.981,97.885
Deliver Us From Eva,She's Got The Part,Usher,2003,게리 하드윅,"LL 쿨 J, 가브리엘 유니온",미국,emt,emt,emt,emt,emt,emt
Down With Love,Down With Love,Michael Buble,2003,페이튼 리드,"르네 젤위거, 이완 맥그리거","멜로/로맨스, 코미디",emt,emt,emt,emt,emt,emt
Down With Love,Here's To You (with Ewan McGregror),Renee Zellweger,2003,페이튼 리드,"르네 젤위거, 이완 맥그리거","멜로/로맨스, 코미디",emt,emt,emt,emt,emt,emt
The Fighting Temptations,Fighting Temptation,Beyonce,2003,조나단 린,"비욘세, 쿠바 구딩 쥬니어, 니젤 워싱턴, 클론 베일리",코미디,emt,emt,emt,emt,emt,emt
The Fighting Temptations,Fever,Beyonce,2003,조나단 린,"비욘세, 쿠바 구딩 쥬니어, 니젤 워싱턴, 클론 베일리",코미디,emt,emt,emt,emt,emt,emt
The Fighting Temptations,Summertime,Beyonce,2003,조나단 린,"비욘세, 쿠바 구딩 쥬니어, 니젤 워싱턴, 클론 베일리",코미디,emt,emt,emt,emt,emt,emt
Finding Nemo,Beyond The Sea,Robbie Williams,2003,앤드류 스탠튼,"앨버트 브룩스, 엘런 드제너러스, 알렉산더 굴드, 윌렘 대포, 브래드 거렛, 앨리슨 제니, 오스틴 펜들튼","애니메이션, 모험, 코미디, 가족",0.284,0.697,0.48,0.306,-12.249,131.376
Freaky Friday,Ultimate,Lindsay Lohan,2003,마크 워터스,"제이미 리 커티스, 린제이 로한, 해롤드 굴드, 채드 마이클 머레이, 스티븐 토보로스키, 크리스티나 비달","코미디, 드라마",0.493,0.00391,0.487,0.807,-4.745,79.524
Freaky Friday,Happy Together,Simple Plan,2003,마크 워터스,"제이미 리 커티스, 린제이 로한, 해롤드 굴드, 채드 마이클 머레이, 스티븐 토보로스키, 크리스티나 비달","코미디, 드라마",0.667,0.00671,0.466,0.947,-4.745,177.825
Freaky Friday,What A Wonderful World,Joey Ramone,2003,마크 워터스,"제이미 리 커티스, 린제이 로한, 해롤드 굴드, 채드 마이클 머레이, 스티븐 토보로스키, 크리스티나 비달","코미디, 드라마",0.496,0.00935,0.422,0.878,-4.863,84.044
Freaky Friday,...Baby One More Time,Bowling For Soup,2003,마크 워터스,"제이미 리 커티스, 린제이 로한, 해롤드 굴드, 채드 마이클 머레이, 스티븐 토보로스키, 크리스티나 비달","코미디, 드라마",0.451,0.00267,0.282,0.612,-4.736,175.834
Freddy vs. Jason,Is It Ever Over,Graeme Revell,2003,우인태,"모니카 키나, 켈리 롤랜드, 제이슨 리터, 크리스 마퀘트, 로슬린 먼로, 캐서린 이자벨","공포, 액션, 스릴러",0.0358,0.664,0.225,0.269,-14.073,138.931
Girl With A Pearl Earring,Griet's Theme,Alexandre Desplat,2003,피터 웨버,"콜린 퍼스, 스칼릿 조핸슨, 톰 윌킨슨","드라마, 멜로/로맨스",0.0987,0.968,0.215,0.182,-14.661,87.575
Gothika,Miranda's Theme,John Ottman,2003,마티유 카소비츠,할리 베리,"공포, 스릴러, 미스터리",0.0437,0.978,0.203,0.162,-18.394,80.549
Honey,Ooh Wee,Mark Ronson,2003,빌 우드러프,"제시카 알바, 메키 파이퍼, 릴 로메오, 조이 브라이언트, 데이빗 모스코, 로넷 맥키, 자차리 윌리암스, 미시 엘리엇","멜로/로맨스, 드라마",0.8,0.0278,0.727,0.961,-3.761,105.031
Honey,I'm Good,Blaque,2003,빌 우드러프,"제시카 알바, 메키 파이퍼, 릴 로메오, 조이 브라이언트, 데이빗 모스코, 로넷 맥키, 자차리 윌리암스, 미시 엘리엇","멜로/로맨스, 드라마",0.708,0.0313,0.662,0.804,-5.062,102.766
How To Lose A Guy In 10 Days,Someone Like You,Keith Urban,2003,도날드 페트리,"매튜 맥커너히, 케이트 허드슨","멜로/로맨스, 코미디",emt,emt,emt,emt,emt,emt
Hulk,Main Titles,Danny Elfman,2003,이안,"에릭 바나, 제니퍼 코넬리, 샘 엘리어트, 조쉬 루카스, 닉 놀테","모험, 액션, 판타지, SF",0.166,0.627,0.539,0.795,-15.091,148.256
Hulk,Set Me Free,Scott Weiland,2003,이안,"에릭 바나, 제니퍼 코넬리, 샘 엘리어트, 조쉬 루카스, 닉 놀테","모험, 액션, 판타지, SF",0.188,9.02E-05,0.293,0.882,-9.555,163.094
Jeepers Creepers II,Jeepers Creepers II End Titles,Bennett Salvay,2003,빅터 살바,"레이 와이즈, 에릭 네닝거, 가리카이 무탐버와","공포, 스릴러",0.027,0.913,0.151,0.0321,-27.237,105.649
Johnny English,A Man For All Seasons,Robbie Williams,2003,피터 호윗,로완 앳킨슨,코미디,0.503,0.0674,0.608,0.602,-9.627,124.023
Kill Bill: Vol. 1,Bang Bang (My Baby Shot Me Down),Nancy Sinatra,2003,쿠엔틴 타란티노,우마 서먼,액션,0.366,0.982,0.433,0.174,-18.791,95.802
Kill Bill: Vol. 1,Don't Let Me Be Misunderstood,Santa Esmeralda,2003,쿠엔틴 타란티노,우마 서먼,액션,0.785,0.0326,0.668,0.815,-8.998,117.809
Kill Bill: Vol. 1,The Lonely Shepherd,Gheorghe Zamfir,2003,쿠엔틴 타란티노,우마 서먼,액션,0.108,0.841,0.434,0.304,-10.799,66.486
Lara Croft Tomb Raider: The Cradle Of Life,Pandora's Box,Alan Silvestri,2003,쟝 드봉,"안젤리나 졸리, 제라드 버틀러","모험, 액션",0.0313,0.921,0.0666,0.115,-19.425,73.444
Lara Croft Tomb Raider: The Cradle Of Life,Satellite,P.O.D.,2003,쟝 드봉,"안젤리나 졸리, 제라드 버틀러","모험, 액션",0.289,0.000211,0.442,0.94,-4.396,155.921
The Last Samurai,Red Warrior,Hans Zimmer,2003,에드워드 즈윅,톰 크루즈,"액션, 모험, 드라마, 전쟁",0.0387,0.0484,0.14,0.399,-13.694,143.661
The League Of Extraordinary Gentlemen,Promenade By The Sea,Trevor Jones,2003,스티븐 노링턴,숀 코네리,"액션, SF, 판타지, 모험",0.407,0.978,0.281,0.148,-18.7,139.663
"Legally Blonde 2: Red, White & Blonde",We Can,LeAnn Rimes,2003,찰스 허먼 움펠드,리즈 위더스푼,코미디,0.421,0.0795,0.49,0.888,-3.812,129.958
The Lizzie McGuire Movie,Why Not,Hilary Duff,2003,짐 펄,힐러리 더프,"가족, 모험, 코미디",0.564,0.0706,0.49,0.843,-4.849,112.85
The Lizzie McGuire Movie,The Tide Is High,Atomic Kitten,2003,짐 펄,힐러리 더프,"가족, 모험, 코미디",0.665,0.0209,0.783,0.649,-4.127,103.997
The Lizzie McGuire Movie,What Dreams Are Made Of (Ballad ver.),Hilary Duff,2003,짐 펄,힐러리 더프,"가족, 모험, 코미디",emt,emt,emt,emt,emt,emt
The Lord Of The Rings: The Return Of The King,Into The West,Annie Lennox,2003,피터 잭슨,"일라이저 우드, 숀 애스틴, 앤디 서키스, 이안 맥켈런, 리브 타일러, 비고 모텐슨, 올랜도 블룸, 존 라이스 데이비스, 빌리 보이드, 도미닉 모나한, 버나드 힐, 미란다 오토","판타지, 모험, 액션, 전쟁",0.0399,0.914,0.312,0.031,-22.035,92.074
Lost In Translation,Too Young,Phoenix,2003,소피아 코폴라,"빌 머레이, 스칼릿 조핸슨, 지오바니 리비시, 안나 페리스, 하야시 후지히로","드라마, 코미디, 멜로/로맨스",0.905,0.0625,0.622,0.75,-6.367,141.324
Lost In Translation,City Girl,Kevin Shields,2003,소피아 코폴라,"빌 머레이, 스칼릿 조핸슨, 지오바니 리비시, 안나 페리스, 하야시 후지히로","드라마, 코미디, 멜로/로맨스",0.17,0.0531,0.311,0.829,-8.698,103.938
Love Actually,Jump (For My Love),Girls Aloud,2003,리차드 커티스,"휴 그랜트, 콜린 퍼스, 리암 니슨, 키이라 나이틀리, 엠마 톰슨, 앨런 릭먼, 빌 나이, 로라 리니, 마틴 맥커친","멜로/로맨스, 드라마, 코미디",0.795,0.00189,0.658,0.826,-6.031,134.465
Love Actually,All You Need Is Love,Lynden David Hall,2003,리차드 커티스,"휴 그랜트, 콜린 퍼스, 리암 니슨, 키이라 나이틀리, 엠마 톰슨, 앨런 릭먼, 빌 나이, 로라 리니, 마틴 맥커친","멜로/로맨스, 드라마, 코미디",emt,emt,emt,emt,emt,emt
Love Actually,Christmas Is All Around,Billy Mack,2003,리차드 커티스,"휴 그랜트, 콜린 퍼스, 리암 니슨, 키이라 나이틀리, 엠마 톰슨, 앨런 릭먼, 빌 나이, 로라 리니, 마틴 맥커친","멜로/로맨스, 드라마, 코미디",0.419,0.0023,0.395,0.692,-6.749,169.994
Love Actually,All I Want For Christmas Is You,Olivia Olson,2003,리차드 커티스,"휴 그랜트, 콜린 퍼스, 리암 니슨, 키이라 나이틀리, 엠마 톰슨, 앨런 릭먼, 빌 나이, 로라 리니, 마틴 맥커친","멜로/로맨스, 드라마, 코미디",emt,emt,emt,emt,emt,emt
Master And Commander: The Far Side Of The World,The Far Side Of The World,Christopher Gordon,2003,피터 위어,"러셀 크로우, 폴 베타니","액션, 드라마, 모험, 전쟁",0.133,0.805,0.264,0.27,-18.572,131.992
The Matrix Reloaded,Session,Linkin Park,2003,"앤디 워쇼스키, 라나 워쇼스키","키아누 리브스, 로렌스 피시번, 캐리 앤 모스","SF, 모험, 액션, 판타지",0.235,0.0336,0.562,0.936,-7.8,98.039
The Matrix Reloaded,Sleeping Awake,P.O.D.,2003,"앤디 워쇼스키, 라나 워쇼스키","키아누 리브스, 로렌스 피시번, 캐리 앤 모스","SF, 모험, 액션, 판타지",0.391,7.49E-05,0.225,0.878,-4.524,133.344
The Matrix Reloaded,Calm Like A Bomb,Rage Against The Machine,2003,"앤디 워쇼스키, 라나 워쇼스키","키아누 리브스, 로렌스 피시번, 캐리 앤 모스","SF, 모험, 액션, 판타지",0.37,0.0234,0.315,0.97,-5.424,149.749
The Matrix Reloaded,Dread Rock,Paul Oakenfold,2003,"앤디 워쇼스키, 라나 워쇼스키","키아누 리브스, 로렌스 피시번, 캐리 앤 모스","SF, 모험, 액션, 판타지",0.205,5.91E-05,0.519,0.748,-5.805,140.011
The Matrix Revolutions,Navras,Juno Reactor,2003,"앤디 워쇼스키, 라나 워쇼스키","키아누 리브스, 로렌스 피시번, 캐리 앤 모스","SF, 스릴러, 액션",0.0775,0.077,0.524,0.717,-8.631,134.992
The Missing,The Long Ride Home,James Horner,2003,론 하워드,"토미 리 존스, 케이트 블란쳇, 에릭 슈웨이그, 에반 레이첼 우드, 제나 보이드, 스티브 리비스, 레이 맥키넌, 발 킬머, 아론 에크하트","드라마, 서부",0.0393,0.825,0.157,0.202,-19.594,134.176
Mona Lisa Smile,Mona Lisa,Seal,2003,마이크 뉴웰,"줄리아 로버츠, 커스틴 던스트, 줄리아 스타일스, 매기 질렌할, 줄리엣 스티븐슨, 도미닉 웨스트","드라마, 코미디, 멜로/로맨스",0.46,0.00349,0.475,0.709,-4.824,133.004
Mona Lisa Smile,The Heart Of Every Girl,Elton John,2003,마이크 뉴웰,"줄리아 로버츠, 커스틴 던스트, 줄리아 스타일스, 매기 질렌할, 줄리엣 스티븐슨, 도미닉 웨스트","드라마, 코미디, 멜로/로맨스",0.637,0.574,0.715,0.523,-6.951,122.108
Once Upon A Time In Mexico,Malaguena,Brian Setzer,2003,로버트 로드리게즈,"안토니오 반데라스, 셀마 헤이엑, 조니 뎁",액션,0.383,0.0435,0.301,0.828,-7.334,87.014
Out Of Time,Out Of Time Theme,Graeme Revell,2003,칼 프랭클린,덴젤 워싱턴,"범죄, 스릴러, 드라마",0.646,0.787,0.487,0.533,-7.494,173.258
Paycheck,Paycheck Main Title,John Powell,2003,오우삼,"벤 애플렉, 아론 에크하트, 우마 서먼","SF, 스릴러, 액션",0.154,0.503,0.615,0.202,-19.018,91.603
Peter Pan,Flying,James Newton Howard,2003,P.J. 호건,"제이슨 아이삭스, 제레미 섬터, 레이첼 허드-우드","가족, 액션, 판타지, 모험",emt,emt,emt,emt,emt,emt
Piglets Big Movie,If I Wasn't So Small (The Piglet Song),Carly Simon,2003,프란시스 글레바스,"존 피들러, 짐 커밍스, 앤드리 스토이카, 캐스 소시, 니키타 홉킨스, 피터 쿨렌, 켄 샌섬, 켄 샌섬",가족,0.426,0.844,0.612,0.247,-11.741,112.845
Pirates Of The Caribbean: The Curse Of The Black Pearl,Barbossa Is Hungry,The City Of Prague Philharmonic Orchestra,2003,고어 버빈스키,"조니 뎁, 제프리 러쉬","판타지, 코미디, 모험, 액션",0.121,0.257,0.236,0.415,-11.911,93.155
Radio,Eyes Of The Heart,India.Arie,2003,마이클 톨린,"쿠바 구딩 쥬니어, 에드 해리스, 데브라 윙거",드라마,0.078,0.546,0.44,0.318,-11.747,130.298
Radio,We Can Work It Out,Stevie Wonder,2003,마이클 톨린,"쿠바 구딩 쥬니어, 에드 해리스, 데브라 윙거",드라마,0.796,0.135,0.608,0.534,-11.541,105.388
The Recruit,Main Title,Klaus Badelt,2003,로저 도널드슨,"알 파치노, 콜린 파렐","액션, 스릴러",0.206,0.908,0.29,0.546,-11.56,102.873
Runaway Jury,Runaway Jury,Christopher Young,2003,게리 플레더,"존 쿠삭, 진 핵크만, 더스틴 호프만, 레이첼 와이즈","드라마, 스릴러",0.0367,0.931,0.0813,0.0825,-20.824,68.056
The Rundown,Williams,Harry Gregson,2003,피터 버그,"드웨인 존슨, 숀 윌리엄 스코트, 크리스토퍼 월켄, 로사리오 도슨, 이완 브렘너, 존 그리스","액션, 모험, 코미디",emt,emt,emt,emt,emt,emt
S.W.A.T.,Time Is Running Out,Apollo Four Forty,2003,클락 존슨,"사무엘 L. 잭슨, 콜린 파렐","액션, 스릴러, 범죄",emt,emt,emt,emt,emt,emt
Shanghai Knights,Magic Bus,The Who,2003,데이빗 돕킨,"성룡, 오웬 윌슨","모험, 코미디, 액션, 서부",0.719,0.00486,0.632,0.947,-5.761,92.313
Sinbad: Legend Of The Seven Seas,Williams,Harry Gregson,2003,"패트릭 길모어, 팀 존슨","브래드 피트, 캐서린 제타 존스","모험, 애니메이션, 액션, 가족",emt,emt,emt,emt,emt,emt
Somethings Gotta Give,I've Got A Crush On You,Steve Tyrell,2003,낸시 마이어스,"잭 니콜슨, 다이안 키튼","코미디, 멜로/로맨스, 드라마",0.231,0.535,0.568,0.375,-9.167,79.09
Somethings Gotta Give,La Vie En Rose,Jack Nicholson,2003,낸시 마이어스,"잭 니콜슨, 다이안 키튼","코미디, 멜로/로맨스, 드라마",emt,emt,emt,emt,emt,emt
Spy Kids 3-D: Game Over,Game Over,Alexa Vega,2003,로버트 로드리게즈,"안토니오 반데라스, 칼라 구기노, 알렉사 베가, 다릴 사바라","SF, 모험, 가족, 액션, 코미디, 판타지",0.81,0.169,0.558,0.949,-5.711,90.029
Sylvia,A Beautiful Dream,Gabriel Yared,2003,크리스틴 제프스,"기네스 팰트로, 다니엘 크레이그",드라마,0.0283,0.94,0.154,0.179,-15.464,106.009
Tears Of The Sun,"The Hourne / Kopano, Pt.3",Hans Zimmer,2003,안톤 후쿠아,브루스 윌리스,"전쟁, 액션, 드라마, 스릴러",emt,emt,emt,emt,emt,emt
Terminator 3: Rise Of The Machines,Hearse Rent A Car,Marco Beltrami,2003,조나단 모스토우,아놀드 슈왈제네거,"액션, 스릴러, SF",0.355,0.00707,0.64,0.857,-11.3,117.908
Terminator 3: Rise Of The Machines,Radio,Marco Beltrami,2003,조나단 모스토우,아놀드 슈왈제네거,"액션, 스릴러, SF",0.0307,0.23,0.112,0.0684,-22.27,85.516
Timeline,Timeline Main Title,Brian Tyler,2003,리차드 도너,"폴 워커, 프란시스 오코너, 제라드 버틀러, 빌리 코놀리","모험, 판타지, SF, 액션",0.0968,0.671,0.191,0.489,-13.263,83.399
Under The Tuscan Sun,End Titles,Christophe Beck,2003,오드리 웰스,다이안 레인,"코미디, 드라마, 멜로/로맨스",0.0882,0.933,0.381,0.238,-15.37,123.798
Underworld,Awakening,Damning Well,2003,"만스 말린드, 비욘 스테인",케이트 베킨세일,"액션, 판타지, 공포",emt,emt,emt,emt,emt,emt
Underworld,Judith (Renholder Mix),Perfect Circle,2003,"만스 말린드, 비욘 스테인",케이트 베킨세일,"액션, 판타지, 공포",emt,emt,emt,emt,emt,emt
Uptown Girls,Charmed Life,Leigh Nash,2003,보아즈 야킨,"브리트니 머피, 다코타 패닝",코미디,emt,emt,emt,emt,emt,emt
Uptown Girls,Time,Chantal Kreviazuk,2003,보아즈 야킨,"브리트니 머피, 다코타 패닝",코미디,0.313,0.35,0.429,0.738,-6.173,167.955
What A Girl Wants,Kiss Kiss,Holly Valance,2003,데니 고돈,"아만다 바인즈, 콜린 퍼스, 켈리 프레스턴","멜로/로맨스, 코미디",0.554,0.00369,0.705,0.717,-4.944,97.036
What A Girl Wants,Long Time Coming,Oliver James,2003,데니 고돈,"아만다 바인즈, 콜린 퍼스, 켈리 프레스턴","멜로/로맨스, 코미디",emt,emt,emt,emt,emt,emt
X2,X,The City Of Prague Philharmonic Orchestra,2003,브라이언 싱어,"패트릭 스튜어트, 휴 잭맨, 이안 맥켈런, 할리 베리, 팜케 얀센, 제임스 마스던, 레베카 로미즌, 브라이언 콕스, 알란 커밍, 브루스 데이비슨, 숀 애쉬모어, 아론 스탠포드, 켈리 후, 안나 파킨","SF, 액션, 모험, 판타지",0.0453,0.0107,0.413,0.407,-11.664,179.764
28 Days Later,An Ending (Acent),Brian Eno,2002,대니 보일,"킬리언 머피, 나오미 해리스, 크리스토퍼 에클리스턴, 메건 번즈, 브렌단 글리슨","스릴러, 공포",0.0451,0.932,0.257,0.0906,-25.381,67.46
28 Days Later,The End,John Murphy,2002,대니 보일,"킬리언 머피, 나오미 해리스, 크리스토퍼 에클리스턴, 메건 번즈, 브렌단 글리슨","스릴러, 공포",0.0781,0.00125,0.467,0.253,-14.232,119.639
8 Mile,Lose Yourself,Eminem,2002,커티스 핸슨,"에미넴, 킴 베이싱어, 브리트니 머피, 안소니 마키","드라마, 뮤지컬",0.059,0.00922,0.689,0.735,-4.545,171.403
8 Mile,Wanksta,50 Cent,2002,커티스 핸슨,"에미넴, 킴 베이싱어, 브리트니 머피, 안소니 마키","드라마, 뮤지컬",0.873,0.0199,0.802,0.863,-3.552,81.008
A Walk To Remember,Only Hope,Mandy Moore,2002,아담 쉥크만,"쉐인 웨스트, 맨디 무어","드라마, 멜로/로맨스",0.234,0.856,0.45,0.294,-9.463,80.272
A Walk To Remember,I Dare You To Move,Switchfoot,2002,아담 쉥크만,"쉐인 웨스트, 맨디 무어","드라마, 멜로/로맨스",0.296,0.00512,0.421,0.891,-4.05,139.999
About A Boy,Something To Talk About,Badly Drawn Boy,2002,"크리스 웨이츠, 폴 웨이츠","휴 그랜트, 토니 콜렛, 레이첼 와이즈, 니콜라스 홀트","코미디, 드라마",0.529,0.0846,0.596,0.61,-9.935,120.46
Austin Powers In Goldmember,Work It Out,Beyonce,2002,제이 로치,마이크 마이어스,"코미디, 액션, 모험, SF",emt,emt,emt,emt,emt,emt
Austin Powers In Goldmember,Hey Goldmember,Foxxy,2002,제이 로치,마이크 마이어스,"코미디, 액션, 모험, SF",emt,emt,emt,emt,emt,emt
Bad Company,B.O.B,OutKast,2002,조엘 슈마허,"안소니 홉킨스, 크리스 록","범죄, 액션, 코미디",0.653,0.0555,0.746,0.978,-5.324,153.809
Ballistic: Ecks vs. Sever,The Name Of The Game,Crystal Method,2002,위치 카오새야난다,"안토니오 반데라스, 루시 리우","액션, 스릴러",emt,emt,emt,emt,emt,emt
Barbershop,Stingy,Ginuwine,2002,팀 스토리,아이스 큐브,"코미디, 드라마",0.617,0.26,0.622,0.573,-6.934,127.132
Barbershop,And We,P. Diddy,2002,팀 스토리,아이스 큐브,"코미디, 드라마",emt,emt,emt,emt,emt,emt
Bend It Like Beckham,I Wish,Victoria Beckham,2002,거린다 차다,"파민더 나그라, 키이라 나이틀리, 조나단 리스 마이어스",드라마,0.822,0.0677,0.754,0.64,-6.92,101.931
Bend It Like Beckham,Independence Day,Melanie C.,2002,거린다 차다,"파민더 나그라, 키이라 나이틀리, 조나단 리스 마이어스",드라마,emt,emt,emt,emt,emt,emt
Blade II,Blade II (Main Title),Marco Beltrami,2002,길예르모 델 토로,웨슬리 스나입스,"액션, 공포",0.487,0.00274,0.486,0.757,-12.261,171.999
Blue Crush,If I Could Fall In Love,Lenny Kravitz,2002,존 스톡웰,"케이트 보스워스, 미셸 로드리게즈, 매튜 데이비스, 사노에 레이크, 미카 부렘, 페이즌 러브",액션,0.112,9.03E-05,0.531,0.752,-5.436,115.785
The Bourne Identity,Main Titles,John Powell,2002,더그 라이만,"맷 데이먼, 프란카 포텐테, 크리스 쿠퍼, 클라이브 오웬, 브라이언 콕스, 아데웰 아킨누오예 아바제","액션, 미스터리, 드라마, 스릴러, 모험",0.37,0.57,0.532,0.422,-10.696,116.279
Brown Sugar,Love Of My Life (An Ode To Hip Hop),Common,2002,릭 파미아,"타이 딕스, 산나 라단","멜로/로맨스, 코미디",emt,emt,emt,emt,emt,emt
Catch Me If You Can,Catch Me If You Can,John Williams,2002,스티븐 스필버그,"레오나르도 디카프리오, 톰 행크스","범죄, 스릴러, 드라마",0.159,0.975,0.239,0.0214,-28.748,75.3
Catch Me If You Can,The Look Of Love,Dusty Springfield,2002,스티븐 스필버그,"레오나르도 디카프리오, 톰 행크스","범죄, 스릴러, 드라마",0.286,0.637,0.688,0.225,-16.074,96.936
Chicago,Jones,Catherine Zeta,2002,롭 마샬,"르네 젤위거, 캐서린 제타 존스, 리차드 기어","뮤지컬, 범죄, 드라마",emt,emt,emt,emt,emt,emt
Chicago,Roxie,Renee Zellweger,2002,롭 마샬,"르네 젤위거, 캐서린 제타 존스, 리차드 기어","뮤지컬, 범죄, 드라마",0.464,0.481,0.514,0.403,-9.377,132.683
Clockstoppers,Holiday In My Head,Smash Mouth,2002,조나단 플레이크,"제시 브래포드, 프렌치 스튜어트","SF, 모험",0.966,0.0622,0.641,0.987,-2.966,124.277
The Count Of Monte Cristo,End Titles,Edward Shearmur,2002,케빈 레이놀즈,"제임스 카비젤, 가이 피어스, 리처드 해리스, 제임스 프레인, 다그마라 도민칙, 마이클 윈콧, 루이스 구즈만","액션, 모험, 범죄, 드라마, 스릴러, 멜로/로맨스",emt,emt,emt,emt,emt,emt
Crossroads,I Love Rock 'N' Roll,Britney Spears,2002,탐라 데이비스,"브리트니 스피어스, 앤슨 마운트, 조 샐다나","드라마, 멜로/로맨스",0.572,0.000811,0.709,0.728,-1.643,180.107
Crossroads,Overprotected (JS16 Remix),Britney Spears,2002,탐라 데이비스,"브리트니 스피어스, 앤슨 마운트, 조 샐다나","드라마, 멜로/로맨스",0.868,0.0888,0.708,0.875,-2.406,95.983
Die Another Day,Die Another Day,Madonna,2002,리 타마호리,피어스 브로스넌,"액션, 모험, 스릴러",0.491,0.062,0.792,0.797,-5.166,123.993
Divine Secrets Of The Ya-Ya Sisterhood,Selah,Lauryn Hill,2002,칼리 코우리,"산드라 블록, 엘렌 버스틴","코미디, 드라마",0.562,0.94,0.483,0.326,-12.145,93.969
Divine Secrets Of The Ya-Ya Sisterhood,Sitting In The Window Of My Room,Alisson Krauss,2002,칼리 코우리,"산드라 블록, 엘렌 버스틴","코미디, 드라마",emt,emt,emt,emt,emt,emt
Drumline,Blowin' Me Up (With Her Love),JC Chasez,2002,찰스 스톤 3세,"닉 캐논, 조 샐다나, J. 안소니 브라운, 지큐, 레오나드 로버츠, 올란도 존스","드라마, 코미디, 멜로/로맨스",0.585,0.0102,0.798,0.78,-3.977,98.139
Drumline,I Want A Girl Like You,Joe,2002,찰스 스톤 3세,"닉 캐논, 조 샐다나, J. 안소니 브라운, 지큐, 레오나드 로버츠, 올란도 존스","드라마, 코미디, 멜로/로맨스",emt,emt,emt,emt,emt,emt
Drumline,Club Banger,Petey Pablo,2002,찰스 스톤 3세,"닉 캐논, 조 샐다나, J. 안소니 브라운, 지큐, 레오나드 로버츠, 올란도 존스","드라마, 코미디, 멜로/로맨스",emt,emt,emt,emt,emt,emt
The Emperors Club,Main Title,Jerry Goldsmith,2002,마이클 호프만,케빈 클라인,드라마,0.0335,0.345,0.172,0.0609,-21.701,117.835
Evelyn,Sitting On Top Of The World,Van Morrison,2002,브루스 베레스포드,"피어스 브로스넌, 에이단 퀸, 줄리아나 마굴리스, 스티븐 레아, 존 린치, 소피 바바서, 앨런 베이츠",드라마,0.408,0.718,0.603,0.298,-10.545,73.611
Evelyn,Angel Rays,Sissel,2002,브루스 베레스포드,"피어스 브로스넌, 에이단 퀸, 줄리아나 마굴리스, 스티븐 레아, 존 린치, 소피 바바서, 앨런 베이츠",드라마,emt,emt,emt,emt,emt,emt
Far From Heaven,Autumn In Connecticut,Elmer Bernstein,2002,토드 헤인즈,"줄리안 무어, 데니스 퀘이드, 데니스 헤이스버트","드라마, 멜로/로맨스",0.0567,0.983,0.169,0.0613,-14.916,67.121
Frida,Alcoba Azul,Elliot Goldenthal,2002,줄리 테이머,"셀마 헤이엑, 알프리드 몰리나, 발레리아 골리노, 미아 마에스트로, 로저 리스",드라마,0.338,0.919,0.497,0.249,-11.674,113.489
Frida,Burn It Blue,Caetano Veloso,2002,줄리 테이머,"셀마 헤이엑, 알프리드 몰리나, 발레리아 골리노, 미아 마에스트로, 로저 리스",드라마,0.0991,0.793,0.376,0.317,-10.325,78.269
Gangs Of New York,The Hands That Built America,U2,2002,마틴 스콜세지,"레오나르도 디카프리오, 다니엘 데이 루이스, 카메론 디아즈","액션, 범죄, 드라마",0.0829,0.49,0.368,0.422,-8.12,161.931
Ghost Ship,My Little Box,John Frizzell,2002,스티브 벡,"줄리아나 마굴리스, 론 엘다드, 데스몬드 헤링턴, 아이제이아 워싱턴, 알렉스 디미트리아디스, 칼 어번, 에밀리 브라우닝, 가브리엘 번","공포, 스릴러, 모험",0.586,0.000751,0.72,0.542,-14.848,99.993
Harry Potter And The Chamber Of Secrets,Prologue: Book Ⅱ And The Escape From The Dursleys,John Williams,2002,크리스 콜럼버스,"다니엘 래드클리프, 루퍼트 그린트, 엠마 왓슨","판타지, 가족, 모험, 액션",0.0552,0.916,0.133,0.187,-19.716,73.394
The Hours,Morning Passages,Philip Glass,2002,스티븐 달드리,"니콜 키드먼, 줄리안 무어, 메릴 스트립",드라마,0.0325,0.979,0.244,0.107,-22.906,106.323
The Importance Of Being Earnest,Importance Of Being Earnest Front Titles,Charlie Mole,2002,올리버 파커,"루퍼트 에버릿, 콜린 퍼스",드라마,0.337,0.85,0.685,0.388,-14.082,124.228
Jackass,A,Sir Mix,2002,제프 트레마인,"조니 녹스빌, 밤 말게라","다큐멘터리, 액션, 코미디",0.79,0.00356,0.952,0.754,-10.254,118.967
Like Mike,Basketball,Bow Wow,2002,존 슐츠,"섀드 모스, 모리스 체스트넛, 조나단 립니키, 로버트 포스터, 크리스핀 글로버, 앤 메라, 유진 레비","가족, 판타지, 코미디",0.736,0.055,0.881,0.779,-5.242,107.726
Lilo & Stitch,Teens,A,2002,"딘 데블로이스, 크리스 샌더스","데이비 체이스, 크리스 샌더스","애니메이션, 가족, 드라마, 코미디, SF",0.537,0.0294,0.414,0.784,-5.083,179.848
