movie_name,ost_name,artist,year,mvdir,mvact,gerne,valence,acousticness,danceability,energy,loudness,tempo
The Twilight Saga: Eclipse,Neutron Star Collision (Love Is Forever),Muse,2010,데이빗 슬레이드,"크리스틴 스튜어트, 로버트 패틴슨, 테일러 로트너","판타지, 멜로/로맨스, 스릴러",0.132,0.00379,0.287,0.9,-5.852,127.997
The Twilight Saga: Eclipse,Eclipse (All Yours),Metric,2010,데이빗 슬레이드,"크리스틴 스튜어트, 로버트 패틴슨, 테일러 로트너","판타지, 멜로/로맨스, 스릴러",0.256,0.764,0.451,0.325,-11.558,119.749
The Twilight Saga: Eclipse,Heavy In Your Arms,Florence + The Machine,2010,데이빗 슬레이드,"크리스틴 스튜어트, 로버트 패틴슨, 테일러 로트너","판타지, 멜로/로맨스, 스릴러",0.3,0.512,0.203,0.799,-5.906,78.766
The Twilight Saga: Eclipse,My Love,Sia,2010,데이빗 슬레이드,"크리스틴 스튜어트, 로버트 패틴슨, 테일러 로트너","판타지, 멜로/로맨스, 스릴러",emt,emt,emt,emt,emt,emt
Valentines Day,Today Was A Fairytale,Taylor Swift,2010,게리 마샬,"제시카 알바, 캐시 베이츠, 제시카 비엘, 브래들리 쿠퍼, 에릭 데인, 패트릭 뎀시, 헥터 엘리존도, 제이미 폭스, 제니퍼 가너, 토퍼 그레이스, 앤 해서웨이, 애쉬튼 커쳐, 퀸 라티파, 테일러 로트너, 조지 로페즈, 셜리 맥클레인, 엠마 로버츠, 줄리아 로버츠, 테일러 스위프트","멜로/로맨스, 코미디",0.344,0.0307,0.491,0.703,-4.5,157.988
Valentines Day,The Way You Look Tonight,Maroon 5,2010,게리 마샬,"제시카 알바, 캐시 베이츠, 제시카 비엘, 브래들리 쿠퍼, 에릭 데인, 패트릭 뎀시, 헥터 엘리존도, 제이미 폭스, 제니퍼 가너, 토퍼 그레이스, 앤 해서웨이, 애쉬튼 커쳐, 퀸 라티파, 테일러 로트너, 조지 로페즈, 셜리 맥클레인, 엠마 로버츠, 줄리아 로버츠, 테일러 스위프트","멜로/로맨스, 코미디",0.611,0.255,0.472,0.505,-6.679,133.482
Valentines Day,Somebody To Love (feat. Robin Ticke),Leighton Meester,2010,게리 마샬,"제시카 알바, 캐시 베이츠, 제시카 비엘, 브래들리 쿠퍼, 에릭 데인, 패트릭 뎀시, 헥터 엘리존도, 제이미 폭스, 제니퍼 가너, 토퍼 그레이스, 앤 해서웨이, 애쉬튼 커쳐, 퀸 라티파, 테일러 로트너, 조지 로페즈, 셜리 맥클레인, 엠마 로버츠, 줄리아 로버츠, 테일러 스위프트","멜로/로맨스, 코미디",emt,emt,emt,emt,emt,emt
The Wolfman,The Traveling Montage,Danny Elfman,2010,조 존스톤,"베니시오 델 토로, 안소니 홉킨스, 에밀리 블런트, 휴고 위빙","공포, 스릴러",0.0359,0.961,0.198,0.284,-13.092,74.705
2012,Time For Miracles,Adam Lambert,2009,롤랜드 에머리히,"존 쿠삭, 아만다 피트, 치웨텔 에지오포, 탠디 뉴튼, 올리버 플랫","액션, 드라마, 스릴러, SF, 모험",0.178,0.00453,0.269,0.707,-3.651,144.343
2012,Fades Like A Photograph,Filter,2009,롤랜드 에머리히,"존 쿠삭, 아만다 피트, 치웨텔 에지오포, 탠디 뉴튼, 올리버 플랫","액션, 드라마, 스릴러, SF, 모험",0.14,0.0295,0.536,0.457,-7.688,145.996
24: Redemption,Open The Gate,Sean Callery,2009,존 캐서,"키퍼 서덜랜드, 체리 존스","범죄, 드라마, 스릴러, 모험, 액션",emt,emt,emt,emt,emt,emt
500 Days Of Summer,"Plesae, Please, Please, Let Me Get What I Want",Smiths,2009,마크 웹,"조셉 고든 레빗, 주이 디샤넬","코미디, 드라마, 멜로/로맨스",0.452,0.523,0.241,0.468,-9.579,91.479
500 Days Of Summer,Here Comes Your Man,Meaghan Smith,2009,마크 웹,"조셉 고든 레빗, 주이 디샤넬","코미디, 드라마, 멜로/로맨스",0.877,0.513,0.844,0.437,-9.506,110.973
9,Welcome Home,Coheed And Cambria,2009,쉐인 액커,"일라이저 우드, 존 C. 라일리, 제니퍼 코넬리, 크리스핀 글로버, 마틴 랜도, 크리스토퍼 플러머","애니메이션, SF, 판타지, 모험",0.158,0.00648,0.442,0.951,-5.27,154.004
Alvin And The Chipmunks: The Squeakquel,No One (feat. Charice),The Chipettes,2009,베티 토마스,"제이슨 리, 저스틴 롱, 매튜 그레이 구블러, 제시 맥카트니","애니메이션, 코미디, 가족, 판타지",0.214,0.103,0.663,0.498,-5.496,89.983
Alvin And The Chipmunks: The Squeakquel,I Gotta Feeling,The Chipmunks,2009,베티 토마스,"제이슨 리, 저스틴 롱, 매튜 그레이 구블러, 제시 맥카트니","애니메이션, 코미디, 가족, 판타지",0.235,0.0245,0.825,0.641,-5.012,130
An Education,Your Heart Is As Black As Night,Melody Gardot,2009,론 쉐르픽,"캐리 멀리건, 피터 사스가드, 알프리드 몰리나, 로자먼드 파이크, 도미닉 쿠퍼, 올리비아 윌리암스, 엠마 톰슨",드라마,0.125,0.851,0.371,0.326,-10.487,76.548
Another Cinderella Story,Tell Me Something I Don't Know,Selena Gomez,2009,데이몬 샌토스테파노,"셀레나 고메즈, 드류 실리","코미디, 뮤지컬, 멜로/로맨스",0.697,0.0309,0.611,0.936,-3.697,144.901
Angels & Demons,160 BPM,Hans Zimmer,2009,론 하워드,톰 행크스,"미스터리, 스릴러, 범죄",0.171,0.444,0.465,0.523,-13.213,160.083
Astro Boy,Theme From Astro Boy,John Ottman,2009,데이빗 보워스,"니콜라스 케이지, 크리스틴 벨, 프레디 하이모어, 도날드 서덜랜드","애니메이션, SF, 가족, 액션",0.104,0.791,0.0924,0.28,-14.656,178.519
Avatar,The Bioluminescence Of The Night,James Horner,2009,제임스 카메론,"샘 워싱턴, 조 샐다나, 시고니 위버","액션, 모험, 판타지",0.0391,0.473,0.186,0.0359,-28.056,127.743
Avatar,I See You,Leona Lewis,2009,제임스 카메론,"샘 워싱턴, 조 샐다나, 시고니 위버","액션, 모험, 판타지",0.173,0.527,0.399,0.252,-17.083,136.018
The Boat That Rocked,Stay With Me Baby,Duffy,2009,리차드 커티스,"필립 세이모어 호프만, 빌 나이, 리스 이판, 닉 프로스트","코미디, 드라마, 멜로/로맨스",emt,emt,emt,emt,emt,emt
Bride Wars,Somethin' Special,Colbie Caillat,2009,게리 위닉,"케이트 허드슨, 앤 해서웨이","코미디, 멜로/로맨스",0.863,0.0142,0.698,0.648,-5.337,115.011
Cheri,The Rose Acacia,Alexandre Desplat,2009,스티븐 프리어스,"미셸 파이퍼, 케시 베이츠, 루퍼트 프렌드","코미디, 드라마, 멜로/로맨스",0.0684,0.702,0.257,0.106,-23.487,143.376
A Christmas Carol,God Bless Us Everyone,Andrea Bocelli,2009,로버트 저메키스,"짐 캐리, 콜린 퍼스, 게리 올드만, 로빈 라이트","애니메이션, 판타지, 가족, 드라마",0.247,0.811,0.26,0.512,-5.645,125.28
A Christmas Carol,A Christmas Carol Main Title,Alan Silvestri,2009,로버트 저메키스,"짐 캐리, 콜린 퍼스, 게리 올드만, 로빈 라이트","애니메이션, 판타지, 가족, 드라마",0.138,0.878,0.188,0.38,-10.509,84.639
Cirque Du Freak: The Vampire's Assistant,The Vampire's Assistant,Stephen Trask,2009,폴 웨이츠,"크리스 마소글리아, 조쉬 허처슨","판타지, 액션",0.43,0.191,0.455,0.658,-9.72,144.049
Coco Before Chanel,L'abandon,Alexandre Desplat,2009,앤 폰테인,오드리 도투,드라마,0.0672,0.986,0.426,0.0208,-29.235,87.96
Coco Before Chanel,Casino De Deauville,Alexandre Desplat,2009,앤 폰테인,오드리 도투,드라마,0.29,0.859,0.317,0.29,-11.556,84.316
Confessions Of A Shopaholic,Accessary,Jordyn Taylor,2009,P.J. 호건,"아일라 피셔, 휴 댄시, 조앤 쿠삭","코미디, 드라마, 멜로/로맨스",emt,emt,emt,emt,emt,emt
Confessions Of A Shopaholic,Stuck with Each Other,Shontelle feat. Akon,2009,P.J. 호건,"아일라 피셔, 휴 댄시, 조앤 쿠삭","코미디, 드라마, 멜로/로맨스",emt,emt,emt,emt,emt,emt
Confessions Of A Shopaholic,Bad Girl,Pussycat Dolls,2009,P.J. 호건,"아일라 피셔, 휴 댄시, 조앤 쿠삭","코미디, 드라마, 멜로/로맨스",emt,emt,emt,emt,emt,emt
Confessions Of A Shopaholic,Again,Natasha Bedingfield,2009,P.J. 호건,"아일라 피셔, 휴 댄시, 조앤 쿠삭","코미디, 드라마, 멜로/로맨스",0.425,0.0236,0.635,0.635,-5.988,92.002
Confessions Of A Shopaholic,Takes Time To Love,Trey Songz,2009,P.J. 호건,"아일라 피셔, 휴 댄시, 조앤 쿠삭","코미디, 드라마, 멜로/로맨스",emt,emt,emt,emt,emt,emt
Coraline,End Credits,Bruno Coulais,2009,헨리 셀릭,"다코타 패닝, 테리 해처","애니메이션, 판타지, 가족, 모험, 스릴러",0.483,0.917,0.463,0.353,-11.359,162.011
Crazy Heart,The Weary Kind,Ryan Bingham,2009,스콧 쿠퍼,"제프 브리지스, 매기 질렌할","드라마, 멜로/로맨스",0.273,0.938,0.48,0.313,-16.358,100.075
Crossing Over,Max Gets Word (End Titles),Mark Isham,2009,웨인 크라머,"해리슨 포드, 레이 리오타, 애슐리 쥬드, 짐 스터게스, 앨리스 이브",드라마,0.0407,0.905,0.138,0.281,-15.211,94.966
Dragonball Evolution,The Final Battle,Brian Tyler,2009,제임스 왕,"저스틴 채트윈, 에미 로섬, 주윤발, 박준형","액션, 모험, 판타지, SF, 스릴러",0.0391,0.634,0.103,0.487,-11.836,66.98
Duplicity,Being Bad,Shana Halligan,2009,토니 길로이,"클라이브 오웬, 줄리아 로버츠, 톰 윌킨슨, 폴 지아마티","범죄, 스릴러, 멜로/로맨스",0.903,0.32,0.756,0.803,-7.922,133.713
Everybodys Fine,Frank's Journey Begins,Dario Marianelli,2009,커크 존스,"로버트 드 니로, 드류 베리모어, 케이트 베킨세일, 샘 록웰, 루시언 메이셀",드라마,0.151,0.963,0.6,0.181,-18.108,106.022
Fame,Out Here On My Own,Naturi Naughton,2009,케빈 탄차로엔,"애셔 북, 케이 파나베이커, 케링턴 페인, 폴 맥길, 월터 페레즈, 나투리 노튼","뮤지컬, 드라마",0.248,0.957,0.355,0.391,-5.217,129.127
Fame,Fame,Naturi Naughton,2009,케빈 탄차로엔,"애셔 북, 케이 파나베이커, 케링턴 페인, 폴 맥길, 월터 페레즈, 나투리 노튼","뮤지컬, 드라마",0.471,0.000483,0.687,0.872,-3.346,130.003
Fame,"This Is My Life (With Ak'Sent, Tynisha Keli, Donte ""Burger"" Wilson)",Hopsin,2009,케빈 탄차로엔,"애셔 북, 케이 파나베이커, 케링턴 페인, 폴 맥길, 월터 페레즈, 나투리 노튼","뮤지컬, 드라마",0.699,0.165,0.854,0.867,-3.548,115.026
Fast & Furious,Outta Sight,Brian Tyler,2009,저스틴 린,"빈 디젤, 폴 워커, 미셸 로드리게즈, 조다나 브류스터",액션,0.452,3.13E-05,0.544,0.79,-10.433,139.943
Fast & Furious,Blanco,Pitbull feat. Pharrell,2009,저스틴 린,"빈 디젤, 폴 워커, 미셸 로드리게즈, 조다나 브류스터",액션,emt,emt,emt,emt,emt,emt
The Final Destination,The Final Destination,Brian Tyler,2009,데이비드 R. 엘리스,"바비 캠포, 샨텔 반샌튼, 닉 자노","공포, 스릴러",0.279,7.84E-06,0.375,0.915,-6.752,165.023
The Fourth Kind,Conclusion,Atli Orvarsson,2009,올라턴드 오선샌미,"밀라 요보비치, 윌 패튼","미스터리, SF, 스릴러",emt,emt,emt,emt,emt,emt
Funny People,Great Day,Paul McCartney,2009,주드 아패토우,"아담 샌들러, 세스 로건, 레슬리 만","코미디, 드라마",0.601,0.646,0.566,0.49,-11.703,85.615
G.I. Joe: The Rise Of Cobra,G.I.Joe,Alan Silvestri,2009,스티븐 소머즈,"채닝 테이텀, 데니스 퀘이드, 이병헌, 조셉 고든 레빗, 시에나 밀러, 레이첼 니콜스, 크리스토퍼 에클리스턴, 레이 파크, 아데웰 아킨누오예 아바제, 아놀드 보슬로, 말론 웨이언스, 조나단 프라이스, 세이드 타그마오우이","액션, 모험, SF, 스릴러",emt,emt,emt,emt,emt,emt
Halloween II,Love Hurts,Nan Vernon,2009,롭 좀비,"쉐리 문 좀비, 체이즈 라이트 베넥, 스카우트 테일러 콤튼, 브래드 듀리프, 캐롤라인 윌리엄스, 말콤 맥도웰, 타일러 메인","공포, 스릴러",emt,emt,emt,emt,emt,emt
Hannah Montana: The Movie,The Climb,Miley Cyrus,2009,피터 첼솜,마일리 사이러스,"코미디, 가족",0.299,0.0635,0.336,0.602,-6.354,161.01
Hannah Montana: The Movie,Crazier,Taylor Swift,2009,피터 첼솜,마일리 사이러스,"코미디, 가족",0.158,0.0631,0.452,0.544,-5.423,133.042
Hannah Montana: The Movie,You'll Always Find Your Way Back Home,Hannah Montana,2009,피터 첼솜,마일리 사이러스,"코미디, 가족",0.692,0.0304,0.577,0.906,-3.673,152.946
Harry Potter And The Half-Blood Prince,Of Love & War,Nicholas Hooper,2009,데이빗 예이츠,"다니엘 래드클리프, 엠마 왓슨, 루퍼트 그린트","판타지, 모험, 미스터리, 멜로/로맨스",0.199,0.919,0.33,0.282,-19.104,77.592
Hes Just Not That Into You,I'd Like To,Corinne Bailey Rae,2009,켄 콰피스,"벤 애플렉, 제니퍼 애니스톤, 드류 베리모어, 제니퍼 코넬리, 케빈 코넬리, 브래들리 쿠퍼, 지니퍼 굿윈, 스칼릿 조핸슨, 저스틴 롱","멜로/로맨스, 코미디, 드라마",0.54,0.172,0.631,0.731,-8.294,85.52
Hotel For Dogs,My New Best Friend,Luke Tierney,2009,쏘어 프류덴탈,"엠마 로버츠, 제이크 T. 오스틴, 돈 치들, 조니 시몬스, 카일라 프랫, 트로이 젠틸","가족, 코미디",emt,emt,emt,emt,emt,emt
Ice Age: Dawn Of The Dinosaurs,You'll Never Find Another Love Like Mine,Lou Rawls,2009,"카를로스 살다나, 마이크 트메이어","존 레귀자모, 데니스 리어리, 퀸 라티파, 레이 로마노, 크리스 웨지","애니메이션, 액션, 모험, 코미디, 가족, 멜로/로맨스",0.934,0.148,0.691,0.718,-8.457,110.623
Inglourious Basterds,Un Amico,Ennio Morricone,2009,쿠엔틴 타란티노,"브래드 피트, 멜라니 로랑, 크리스토프 왈츠, 일라이 로스, 마이클 패스벤더, 다이앤 크루거, 다니엘 브륄, 틸 슈바이거","액션, 드라마, 전쟁",0.445,0.0204,0.313,0.606,-7.833,143.473
The International,End Title,Tom Tykwer & Johnny Klimek & Reinhold Heil,2009,톰 티크베어,"클라이브 오웬, 나오미 왓츠","액션, 범죄, 미스터리, 스릴러",emt,emt,emt,emt,emt,emt
Jennifers Body,Kiss With A Fist,Florence + The Machine,2009,캐린 쿠사마,"메간 폭스, 아만다 사이프리드","공포, SF, 스릴러, 코미디",0.692,0.00154,0.406,0.778,-5.383,106.933
Jennifers Body,New Perspective,Panic! At The Disco,2009,캐린 쿠사마,"메간 폭스, 아만다 사이프리드","공포, SF, 스릴러, 코미디",0.514,0.00313,0.367,0.881,-4.752,164.028
Knowing,Caleb Leaves,Marco Beltrami,2009,알렉스 프로야스,니콜라스 케이지,"드라마, 미스터리, SF, 스릴러",0.0328,0.94,0.0717,0.133,-14.77,76.824
Monsters vs Aliens,52's,The B,2009,"롭 레터맨, 콘래드 버논","리즈 위더스푼, 한예슬, 휴 로리, 세스 로건, 레인 윌슨, 키퍼 서덜랜드, 스티븐 콜베어, 르네 젤위거","SF, 모험, 애니메이션",emt,emt,emt,emt,emt,emt
My Sisters Keeper,My Sister's Keeper End Title,Aaron Zigman,2009,닉 카사베츠,"카메론 디아즈, 아비게일 브레스린, 알렉 볼드윈, 제이슨 패트릭, 소피아 바실리바",드라마,0.0372,0.909,0.124,0.117,-19.338,148.333
Night At The Museum: Battle Of The Smithsonian,Night At The Museum: Battle Of The Smithsonian,Alan Silvestri,2009,숀 레비,"벤 스틸러, 에이미 아담스, 오웬 윌슨, 행크 아자리아, 로빈 윌리엄스","액션, 모험, 코미디, 가족, 판타지",0.0697,0.827,0.221,0.3,-15.278,105.929
Ninja Assassin,Ninja Assassin,Ilan Eshkeri,2009,제임스 맥티그,비,"액션, 범죄, 드라마, 스릴러",emt,emt,emt,emt,emt,emt
Notorious,Juicy,Notorious B.I.G.,2009,조지 틸만 주니어,"자말 우라드, 안젤라 바셋, 데릭 루크, 안소니 마키, 나투리 노튼, 데니스 L.A. 화이트",드라마,0.777,0.473,0.889,0.818,-4.639,96.063
Notorious,One More Chance / The Legacy Remix,Notorious B.I.G.,2009,조지 틸만 주니어,"자말 우라드, 안젤라 바셋, 데릭 루크, 안소니 마키, 나투리 노튼, 데니스 L.A. 화이트",드라마,0.685,0.22,0.789,0.764,-4.48,91.046
Obsessed,Any Other Day,Wyclef Jean & Norah Jones,2009,스티브 쉴,"비욘세, 이드리스 엘바, 알리 라터, 크리스틴 라티","드라마, 스릴러",emt,emt,emt,emt,emt,emt
Orphan,The Glory Of Love,Jimmy Durante,2009,자움 콜렛 세라,"베라 파미가, 피터 사스가드, 이사벨 퍼만","공포, 미스터리, 스릴러, 드라마",0.516,0.788,0.487,0.258,-11.801,96.645
Planet 51,Lolipop,Sophie Green,2009,"호르헤 블랑코, 하비에르 아바드, 마르코스 마르티네즈","드웨인 존슨, 제시카 비엘, 저스틴 롱, 게리 올드만, 숀 윌리엄 스코트, 존 클리즈","애니메이션, 모험, 코미디, 가족, 판타지, SF",emt,emt,emt,emt,emt,emt
Ponyo,벼랑 위의 포뇨 (崖の上のポニョ),Fujioka Fujimaki,2009,미야자키 하야오,"나라 유리아, 도이 히로키, 야마구치 토모코","모험, 가족, 애니메이션",emt,emt,emt,emt,emt,emt
Ponyo,만남 (出會い),Hisaishi Joe,2009,미야자키 하야오,"나라 유리아, 도이 히로키, 야마구치 토모코","모험, 가족, 애니메이션",emt,emt,emt,emt,emt,emt
Precious,I Can See In Color,Mary J. Blige,2009,리 다니엘스,"가보리 시디베, 폴라 패튼, 머라이어 캐리, 레니 크라비츠, 모니크",드라마,emt,emt,emt,emt,emt,emt
Precious,System,LaBelle,2009,리 다니엘스,"가보리 시디베, 폴라 패튼, 머라이어 캐리, 레니 크라비츠, 모니크",드라마,0.699,0.233,0.704,0.399,-6.902,91.102
Precious,Letters,Mario Grigorov,2009,리 다니엘스,"가보리 시디베, 폴라 패튼, 머라이어 캐리, 레니 크라비츠, 모니크",드라마,emt,emt,emt,emt,emt,emt
The Princess And The Frog,Yo,Ne,2009,"론 클레멘츠, 존 머스커","아니카 노니 로즈, 브루노 캄포스, 키스 데이빗","애니메이션, 가족, 뮤지컬, 멜로/로맨스",0.292,0.00207,0.577,0.941,-5.17,101.921
Princess Protection Program,One And The Same,Selena Gomez & Demi Lovato,2009,앨리슨 리디,"셀레나 고메즈, 데미 로바토","코미디, 드라마, 가족",emt,emt,emt,emt,emt,emt
Princess Protection Program,Two Worlds Collide,Demi Lovato,2009,앨리슨 리디,"셀레나 고메즈, 데미 로바토","코미디, 드라마, 가족",0.486,0.00735,0.206,0.711,-4.606,179.499
Public Enemies,Bye Bye Blackbird,Diana Krall,2009,마이클 만,"크리스찬 베일, 조니 뎁","드라마, 범죄, 멜로/로맨스, 스릴러",0.151,0.857,0.402,0.0492,-21.338,111.506
Public Enemies,Ten Million Slaves,Otis Taylor,2009,마이클 만,"크리스찬 베일, 조니 뎁","드라마, 범죄, 멜로/로맨스, 스릴러",0.543,0.561,0.478,0.435,-7.94,132.347
Public Enemies,Love Me Or Leave Me,Billie Holiday,2009,마이클 만,"크리스찬 베일, 조니 뎁","드라마, 범죄, 멜로/로맨스, 스릴러",0.733,0.855,0.62,0.208,-11.68,113.472
Sherlock Holmes,Catatonic,Hans Zimmer,2009,가이 리치,"로버트 다우니 주니어, 주드 로, 레이첼 맥아담스, 마크 스트롱","액션, 모험, 범죄, 드라마, 미스터리, 스릴러",0.061,0.271,0.364,0.213,-15.969,141.985
A Single Man,Stillness Of The Mind,Abel Korzeniowski & Studio Orchestra,2009,톰 포드,"콜린 퍼스, 줄리안 무어",드라마,emt,emt,emt,emt,emt,emt
The Soloist,Pershing Square,Dario Marianelli,2009,조 라이트,"제이미 폭스, 로버트 다우니 주니어",드라마,0.0398,0.981,0.24,0.00581,-27.134,134.2
Star Trek: The Beginning,End Credits,Michael Giacchino,2009,J.J. 에이브럼스,"크리스 파인, 재커리 퀸토","SF, 액션",0.353,0.03,0.345,0.599,-10.619,124.641
Terminator Salvation,Rooster,Alice In Chains,2009,맥지,"크리스찬 베일, 샘 워싱턴, 안톤 옐친, 문 블러드굿","SF, 스릴러, 액션, 모험",0.2,0.0307,0.271,0.551,-8.46,143.899
Terminator Salvation,Final Confrontation,Danny Elfman,2009,맥지,"크리스찬 베일, 샘 워싱턴, 안톤 옐친, 문 블러드굿","SF, 스릴러, 액션, 모험",0.0388,0.669,0.197,0.319,-13.751,125.112
The Time Travelers Wife,Broken,Lifehouse,2009,로베르트 슈벤트케,"에릭 바나, 레이첼 맥아담스","멜로/로맨스, 드라마, 판타지",0.488,0.089,0.534,0.708,-5.732,130.639
The Time Travelers Wife,See You Again,Mychael Danna,2009,로베르트 슈벤트케,"에릭 바나, 레이첼 맥아담스","멜로/로맨스, 드라마, 판타지",0.0361,0.944,0.13,0.119,-18.688,96.05
Transformers: Revenge Of The Fallen,NEST,Steve Jablonsky,2009,마이클 베이,"샤이아 라보프, 메간 폭스, 휴고 위빙, 조쉬 더하멜, 존 터투로","SF, 액션, 모험",0.736,0.496,0.71,0.318,-20.645,89.979
Transformers: Revenge Of The Fallen,New Divide,Linkin Park,2009,마이클 베이,"샤이아 라보프, 메간 폭스, 휴고 위빙, 조쉬 더하멜, 존 터투로","SF, 액션, 모험",0.38,0.000235,0.493,0.808,-3.365,117.971
Transformers: Revenge Of The Fallen,21 Guns,Green Day,2009,마이클 베이,"샤이아 라보프, 메간 폭스, 휴고 위빙, 조쉬 더하멜, 존 터투로","SF, 액션, 모험",0.416,0.0518,0.268,0.742,-4.939,159.779
Transformers: Revenge Of The Fallen,Never Say Never,The Fray,2009,마이클 베이,"샤이아 라보프, 메간 폭스, 휴고 위빙, 조쉬 더하멜, 존 터투로","SF, 액션, 모험",0.262,0.568,0.23,0.492,-5.767,160.139
The Twilight Saga: New Moon,New Moon,Alexandre Desplat,2009,크리스 웨이츠,"크리스틴 스튜어트, 로버트 패틴슨","판타지, 멜로/로맨스, 드라마, 스릴러",0.105,0.987,0.449,0.0844,-19.391,124.936
The Twilight Saga: New Moon,Meet Me On The Equinox,Death Cab For Cutie,2009,크리스 웨이츠,"크리스틴 스튜어트, 로버트 패틴슨","판타지, 멜로/로맨스, 드라마, 스릴러",0.496,0.137,0.486,0.892,-6.251,135.005
The Twilight Saga: New Moon,Solar Midnite,Lupe Fiasco,2009,크리스 웨이츠,"크리스틴 스튜어트, 로버트 패틴슨","판타지, 멜로/로맨스, 드라마, 스릴러",emt,emt,emt,emt,emt,emt
The Twilight Saga: New Moon,Satellite Heart,Anya Marina,2009,크리스 웨이츠,"크리스틴 스튜어트, 로버트 패틴슨","판타지, 멜로/로맨스, 드라마, 스릴러",0.138,0.13,0.45,0.393,-9.472,75.974
The Twilight Saga: New Moon,Hearing Damage,Thom Yorke,2009,크리스 웨이츠,"크리스틴 스튜어트, 로버트 패틴슨","판타지, 멜로/로맨스, 드라마, 스릴러",0.133,0.0474,0.627,0.859,-6.321,116.019
Up,Up With Titles,Michael Giacchino,2009,"피트 닥터, 밥 피터슨","에드워드 애스너, 조던 나가이, 크리스토퍼 플러머, 밥 피터슨","애니메이션, 가족, 모험, 코미디, 액션",0.721,0.659,0.268,0.28,-15.8,200.726
Watchmen,Desolation Row,My Chemical Romance,2009,잭 스나이더,"잭키 얼 헤일리, 제프리 딘 모건, 빌리 크루덥, 말린 애커맨, 칼라 구기노, 패트릭 윌슨, 매튜 구드","액션, 드라마, SF, 판타지, 스릴러",0.0719,0.00017,0.297,0.981,-4.222,168.281
Watchmen,Hallelujah,Leonard Cohen,2009,잭 스나이더,"잭키 얼 헤일리, 제프리 딘 모건, 빌리 크루덥, 말린 애커맨, 칼라 구기노, 패트릭 윌슨, 매튜 구드","액션, 드라마, SF, 판타지, 스릴러",0.232,0.715,0.28,0.344,-12.577,171.143
Where The Wild Things Are,All Is Love,Karen O,2009,스파이크 존즈,"맥스 레코드, 포레스트 휘태커, 캐서린 키너, 마크 러팔로","모험, 드라마, 가족, 판타지",0.285,0.311,0.694,0.545,-9.503,120.02
Whip It,Pot Kettle Black,Tilly And The Wall,2009,드류 베리모어,"엘리엇 페이지, 마샤 게이 하든",드라마,0.63,0.104,0.584,0.91,-4.339,136.136
Whiteout,The Whiteout,John Frizzell,2009,도미닉 세나,케이트 베킨세일,"액션, 범죄, 드라마, 스릴러, 미스터리",0.0685,0.496,0.288,0.621,-18.182,141.853
Wizards Of Waverly Place,Magic,Selena Gomez,2009,레브 L. 스피로,"셀레나 고메즈, 데이빗 헨리, 제이크 T. 오스틴","모험, 코미디, 가족, 판타지",0.442,0.00504,0.6,0.916,-3.071,104.091
X-Men Origins: Wolverine,Logan Through Time,Harry Gregson,2009,개빈 후드,휴 잭맨,"SF, 액션, 판타지, 스릴러",0.0771,0.432,0.147,0.471,-15.138,170.326
"10,000 BC","10,000 BC/End Credits",Harald Kloser,2008,롤랜드 에머리히,"스티븐 스트레이트, 카밀라 벨, 클리프 커티스","모험, 드라마",0.151,0.00255,0.0898,0.529,-12.916,83.555
21,Time To Pretend,MGMT,2008,로버트 루케틱,"짐 스터게스, 케이트 보스워스, 아론 유, 리자 라피라, 제이콥 피츠, 조시 게드, 샘 골자리, 로렌스 피시번, 케빈 스페이시","범죄, 드라마",0.421,8.74E-05,0.438,0.94,-3.249,100.99
27 Dresses,A Perfect Wedding Day,Randy Edelman,2008,앤 플레쳐,"캐서린 헤이글, 제임스 마스던","멜로/로맨스, 코미디",0.316,0.85,0.366,0.165,-13.796,119.288
Babylon A.D.,Babylon Requiem,Atli Orvarsson,2008,마티유 카소비츠,"빈 디젤, 멜라니 티에리, 양자경","SF, 액션, 모험, 스릴러",emt,emt,emt,emt,emt,emt
Body Of Lies,White Whale,Marc Streitenfeld,2008,리들리 스콧,"레오나르도 디카프리오, 러셀 크로우","액션, 스릴러",0.0367,0.927,0.341,0.214,-18.89,90.443
Bolt,I Thought I Lost You,Miley Cyrus & John Travolta,2008,"바이론 하워드, 크리스 윌리엄스","존 트라볼타, 마일리 사이러스, 수지 에스먼, 마크 월튼","모험, 코미디, 가족, 판타지, 애니메이션",emt,emt,emt,emt,emt,emt
Cadillac Records,Once In A Lifetime,Beyonce,2008,다넬 마틴,"엠마누엘 크리퀴, 애드리언 브로디","드라마, 뮤지컬, 멜로/로맨스",emt,emt,emt,emt,emt,emt
Cadillac Records,At Last,Beyonce,2008,다넬 마틴,"엠마누엘 크리퀴, 애드리언 브로디","드라마, 뮤지컬, 멜로/로맨스",emt,emt,emt,emt,emt,emt
Cadillac Records,Let's Take A Walk,Raphael Saadiq,2008,다넬 마틴,"엠마누엘 크리퀴, 애드리언 브로디","드라마, 뮤지컬, 멜로/로맨스",0.339,0.115,0.807,0.659,-4.294,111.021
Cadillac Records,6 O'clock Blues,Solange,2008,다넬 마틴,"엠마누엘 크리퀴, 애드리언 브로디","드라마, 뮤지컬, 멜로/로맨스",0.679,0.0074,0.649,0.774,-5.775,89.61
